{
  "$schema": "./registry.schema.json",
  "name": "Design System Glass",
  "version": 2,
  "prefix": "dsg-",
  "updated": "2026-10-21",
  "status": "stable",
  "components": [
    {
      "id": "cover",
      "name": "Cover",
      "status": "stable",
      "since": "2.0.0",
      "summary": "Portada de marca con el hero de vidrio y el átomo animado.",
      "files": {
        "readme": "components/Cover/README.md",
        "preview": "components/Cover/preview.html"
      },
      "classes": [],
      "variants": [],
      "useWhen": [
        "En la galería o en una página de inicio que presente el sistema.",
        "En material de marca que necesite el hero con el átomo."
      ],
      "avoidWhen": [
        "Como cabecera de una pantalla de producto.",
        "En contextos donde el átomo compita con datos o acciones."
      ],
      "composition": [
        "Fondo con gradiente y manchas; texto a la izquierda; átomo a la derecha.",
        "Una acción primaria y una secundaria como máximo."
      ],
      "accessibility": [
        "El átomo es decorativo: aria-hidden y alt vacío.",
        "El texto mantiene contraste 4.5:1 sobre el fondo.",
        "Con prefers-reduced-motion el átomo queda estático."
      ],
      "example": "<img src=\"assets/brand/banner.svg\" alt=\"Design System Glass\">",
      "related": ["Glass", "Button"]
    },
    {
      "id": "glass",
      "name": "Glass",
      "status": "stable",
      "since": "1.0.0",
      "summary": "Superficie translúcida base: cards, paneles, menú lateral, hero y modales.",
      "files": {
        "readme": "components/Glass/README.md",
        "preview": "components/Glass/preview.html"
      },
      "classes": [
        ".dsg-glass",
        ".dsg-glass--panel",
        ".dsg-glass--hero",
        ".dsg-inset",
        ".dsg-mesh",
        ".dsg-mesh--admin"
      ],
      "variants": [
        { "name": "card", "class": ".dsg-glass", "when": "Card por defecto, radio 22px." },
        { "name": "panel", "class": ".dsg-glass--panel", "when": "Paneles grandes y menú lateral, radio 26px." },
        { "name": "hero", "class": ".dsg-glass--hero", "when": "Solo el hero de una página, radio 32px." },
        { "name": "inset", "class": ".dsg-inset", "when": "Fila o elemento elevado dentro de otro vidrio." }
      ],
      "useWhen": [
        "Para agrupar contenido sobre el fondo de manchas .dsg-mesh.",
        "Cuando se necesita jerarquía sin sumar otro nivel de vidrio."
      ],
      "avoidWhen": [
        "Sin color detrás: el vidrio se ve plano, sobre todo en claro.",
        "Anidando .dsg-glass dentro de .dsg-glass; usa .dsg-inset."
      ],
      "composition": [
        "Toda página que use vidrio lleva .dsg-mesh en el body.",
        "La jerarquía es hero > panel > glass > inset."
      ],
      "accessibility": [
        "El texto usa ink, ink-muted o ink-subtle, todos con 4.5:1.",
        "No uses el vidrio como única señal de agrupación; acompaña con títulos."
      ],
      "example": "<article class=\"dsg-glass\" style=\"padding:24px\">…</article>",
      "related": ["Button", "Scorecard", "Notice"]
    },
    {
      "id": "button",
      "name": "Button",
      "status": "stable",
      "since": "1.0.0",
      "summary": "Botones pill para acciones primarias y botones de decisión para revisión.",
      "files": {
        "readme": "components/Button/README.md",
        "preview": "components/Button/preview.html"
      },
      "classes": [
        ".dsg-btn",
        ".dsg-btn--primary",
        ".dsg-btn--secondary",
        ".dsg-btn--ghost",
        ".dsg-btn--success",
        ".dsg-btn--danger",
        ".dsg-btn--icon"
      ],
      "variants": [
        { "name": "primary", "class": ".dsg-btn--primary", "when": "Una sola acción principal por vista." },
        { "name": "secondary", "class": ".dsg-btn--secondary", "when": "Acción alternativa junto a la principal." },
        { "name": "ghost", "class": ".dsg-btn--ghost", "when": "Cancelar o acción de baja prioridad." },
        { "name": "success", "class": ".dsg-btn--success", "when": "Aprobar y publicar en un flujo de revisión." },
        { "name": "danger", "class": ".dsg-btn--danger", "when": "Rechazar o destruir; contorno, nunca relleno." },
        { "name": "icon", "class": ".dsg-btn--icon", "when": "Solo ícono, 44×44; requiere aria-label." }
      ],
      "useWhen": [
        "Para ejecutar una acción o navegar a otra página.",
        "Para confirmar o rechazar una propuesta en revisión."
      ],
      "avoidWhen": [
        "Como div con onClick: usa button o a href.",
        "Para dos acciones primarias en la misma vista."
      ],
      "composition": [
        "Primario + secundario/ghost es la pareja estándar.",
        "El texto nombra la acción: «Enviar solicitud», no «Aceptar»."
      ],
      "accessibility": [
        "Altura mínima 48px; 44px en botones de ícono.",
        "Foco visible de 2px en accent con offset 3px.",
        "Un botón solo con ícono lleva aria-label."
      ],
      "example": "<button class=\"dsg-btn dsg-btn--primary\">Explorar componentes</button>",
      "related": ["Glass", "SegmentedControl"]
    },
    {
      "id": "segmented-control",
      "name": "SegmentedControl",
      "status": "stable",
      "since": "1.0.0",
      "summary": "Grupo de 2 a 4 opciones excluyentes para cambiar de vista o periodo.",
      "files": {
        "readme": "components/SegmentedControl/README.md",
        "preview": "components/SegmentedControl/preview.html"
      },
      "classes": [".dsg-seg", ".dsg-seg__btn"],
      "variants": [
        { "name": "tabs", "class": ".dsg-seg__btn[aria-selected=\"true\"]", "when": "Cambia la vista visible; usa role=tablist y role=tab." },
        { "name": "filter", "class": ".dsg-seg__btn[aria-pressed=\"true\"]", "when": "Filtra un periodo; usa role=group y aria-pressed." }
      ],
      "useWhen": [
        "Para 2 a 4 opciones excluyentes y visibles al mismo tiempo.",
        "Para alternar entre vistas o periodos sin salir de la página."
      ],
      "avoidWhen": [
        "Con más de 4 opciones: usa un select.",
        "Para navegación entre páginas: usa NavItem."
      ],
      "composition": [
        "Contenedor .dsg-glass .dsg-seg.",
        "La opción activa usa accent + on-accent; las demás, ink-muted."
      ],
      "accessibility": [
        "Vistas: role=tablist, role=tab y aria-selected.",
        "Filtros: role=group con aria-label y aria-pressed.",
        "Objetivo táctil mínimo 42px."
      ],
      "example": "<div role=\"tablist\" class=\"dsg-glass dsg-seg\"><button role=\"tab\" aria-selected=\"true\" class=\"dsg-seg__btn\">Vista</button></div>",
      "related": ["Button", "Glass"]
    },
    {
      "id": "nav-item",
      "name": "NavItem",
      "status": "stable",
      "since": "1.0.0",
      "summary": "Elemento del menú lateral con ícono, estado activo y contador opcional.",
      "files": {
        "readme": "components/NavItem/README.md",
        "preview": "components/NavItem/preview.html"
      },
      "classes": [".dsg-nav-item", ".dsg-nav-count"],
      "variants": [
        { "name": "default", "class": ".dsg-nav-item", "when": "Enlace inactivo del menú." },
        { "name": "active", "class": ".dsg-nav-item[aria-current=\"page\"]", "when": "Página actual; fondo glass-strong, texto ink e ícono accent." },
        { "name": "count", "class": ".dsg-nav-count", "when": "Elementos que piden acción: revisiones o solicitudes pendientes." }
      ],
      "useWhen": [
        "En el menú lateral de una aplicación o documentación.",
        "Para agrupar navegación con .dsg-overline."
      ],
      "avoidWhen": [
        "Para acciones que no navegan: usa Button.",
        "Para el menú principal horizontal de marketing."
      ],
      "composition": [
        "Vive dentro de .dsg-glass--panel.",
        "Ícono de 20px, trazo 1.8 y aria-hidden; el texto siempre visible."
      ],
      "accessibility": [
        "El activo lleva aria-current=\"page\".",
        "El contador no reemplaza el texto; el enlace sigue siendo descriptivo.",
        "En móvil se apila y se colapsa en un botón de menú."
      ],
      "example": "<a href=\"#\" aria-current=\"page\" class=\"dsg-nav-item\">Proyectos</a>",
      "related": ["Glass", "StatusChip"]
    },
    {
      "id": "status-chip",
      "name": "StatusChip",
      "status": "stable",
      "since": "1.0.0",
      "summary": "Chip de estado para proyectos, propuestas y roles, más el tag neutro de categorías.",
      "files": {
        "readme": "components/StatusChip/README.md",
        "preview": "components/StatusChip/preview.html"
      },
      "classes": [
        ".dsg-chip",
        ".dsg-chip--accent",
        ".dsg-chip--warm",
        ".dsg-chip--success",
        ".dsg-chip--danger",
        ".dsg-chip--admin",
        ".dsg-tag"
      ],
      "variants": [
        { "name": "neutral", "class": ".dsg-chip", "when": "Planeado, Borrador, Por definir." },
        { "name": "accent", "class": ".dsg-chip--accent", "when": "En desarrollo." },
        { "name": "warm", "class": ".dsg-chip--warm", "when": "Piloto, Pendiente de revisión." },
        { "name": "success", "class": ".dsg-chip--success", "when": "Liberado, Aprobada, Publicada." },
        { "name": "danger", "class": ".dsg-chip--danger", "when": "Bloqueado, Cambios solicitados, Rechazada." },
        { "name": "admin", "class": ".dsg-chip--admin", "when": "Rol ADMIN o superficie administrativa." },
        { "name": "tag", "class": ".dsg-tag", "when": "Categorías y skills; no comunica estado." }
      ],
      "useWhen": [
        "Para comunicar un estado con texto y color.",
        "Para clasificar contenido con .dsg-tag."
      ],
      "avoidWhen": [
        "Como único portador de un estado: el texto es obligatorio.",
        "Para acciones: usa Button."
      ],
      "composition": [
        "El color sale de --c; relleno al 15% y borde al 35%.",